{"$schema":"https://json-schema.org/draft/2020-12/schema","$id":"https://agensfield.dev/scriba/schemas/events.schema.json","title":"Scriba agent event page","type":"object","additionalProperties":false,"required":["schemaVersion","generatedAt","accountId","events","cursor"],"properties":{"schemaVersion":{"const":"scriba.events.v2"},"generatedAt":{"type":"string","format":"date-time"},"accountId":{"type":"string","pattern":"^acct-[0-9a-f]{20}$"},"events":{"type":"array","maxItems":100,"items":{"$ref":"event.schema.json"}},"cursor":{"type":"object","additionalProperties":false,"required":["next","highWater"],"properties":{"next":{"$ref":"#/$defs/cursor"},"highWater":{"$ref":"#/$defs/cursor"}}}},"$defs":{"cursor":{"type":"string","pattern":"^v1\\.[0-7][0-9a-f]{15}$","minLength":19,"maxLength":19}}}
